{
  "diagnostics": [],
  "producer": {
    "name": "wiretap",
    "version": "1.0.0-draft.1"
  },
  "selection": {
    "mode": "replace-selected-tests",
    "scope": "complete",
    "test_ids": [
      "test:checkout"
    ]
  },
  "sources": [
    {
      "id": "application-source-0ce21158a98846a9",
      "role": "application",
      "state": "unknown"
    },
    {
      "id": "tests-source-4a58b11193de380c",
      "role": "tests",
      "state": "unknown"
    }
  ],
  "target_source_ids": [
    "application-source-0ce21158a98846a9",
    "tests-source-4a58b11193de380c"
  ]
}
