{
  "diagnostics": [],
  "producer": {
    "name": "example-producer",
    "version": "1.0"
  },
  "selection": {
    "mode": "replace-selected-tests",
    "scope": "complete",
    "test_ids": [
      "test:create-payment"
    ]
  },
  "sources": [
    {
      "dirty": false,
      "id": "application-source",
      "repository": "https://example.com/payments.git",
      "revision": "aaaaaaaaaaaaaaaaaaaaaaaaaaaaaaaaaaaaaaaa",
      "role": "application",
      "state": "known"
    },
    {
      "dirty": false,
      "id": "test-source",
      "repository": "https://example.com/payments.git",
      "revision": "aaaaaaaaaaaaaaaaaaaaaaaaaaaaaaaaaaaaaaaa",
      "role": "tests",
      "state": "known"
    }
  ],
  "target_source_ids": [
    "application-source",
    "test-source"
  ]
}
